{
  "$schema": "./catalog.schema.json",
  "schemaVersion": "1.0",
  "snapshotVerificadoEl": "2026-10-18",
  "comoSeInstala": "Metodo por defecto: winget install --id <Id> --exact --source winget --accept-package-agreements --accept-source-agreements --silent. winget comprueba el SHA-256 del instalador contra el manifiesto del repositorio comunitario (microsoft/winget-pkgs) antes de ejecutarlo, y Windows verifica la firma Authenticode. Tras instalar, scripts/win/Install-Apps.ps1 vuelve a comprobar la firma del binario contra 'verificacion.firmanteEsperado'.",
  "importante": [
    "Nada de esto es obligatorio: solo se instalan las apps del conjunto elegido en apps.selections (o --apps custom).",
    "Ningun instalador se descarga de un espejo ni de repositorios de terceros: ver apps/sources.json.",
    "'versionObservada' es el ultimo paquete presente en winget-pkgs en la fecha del snapshot; es informativo. Vaciar o no pinar 'instalacion.version' para recibir la version actual."
  ],
  "aplicaciones": [
    {
      "id": "7zip.7zip",
      "nombre": "7-Zip",
      "categoria": "utilidad",
      "conjuntos": ["minimal", "utilities", "gaming", "full"],
      "descripcion": "Compresion/descompresion 7z, ZIP, RAR, ISO. Cubre el requisito de 'herramientas de compresion de archivos'.",
      "fuente": { "oficial": "https://www.7-zip.org/", "descargaDirecta": "https://www.7-zip.org/download.html" },
      "instalacion": { "metodo": "winget", "arch": "x64" },
      "verificacion": {
        "firmanteEsperado": ["Igor Pavlov"],
        "ejecutableRuta": "%ProgramFiles%\\7-Zip\\7z.exe",
        "installerSha256": "D54BF805F9F3704D1E8DB2FA3498AE7EF2DF0312B40B558E7C71C734430A665D",
        "nota": "26.04 x64 (snapshot). El ejecutable de 7-Zip esta firmado por el propio autor; si el firmante cambia, la comprobacion debe fallar."
      },
      "compatibilidad": { "ediciones": [], "requiereGpu": false, "nota": "Ninguna." },
      "postInstalacion": ["anadir-al-escritorio"],
      "riesgos": []
    },
    {
      "id": "Microsoft.WindowsTerminal",
      "nombre": "Windows Terminal",
      "categoria": "utilidad",
      "conjuntos": ["minimal", "utilities", "full"],
      "descripcion": "Terminal moderno para PowerShell/CMD; util para ejecutar los scripts de diagnostico.",
      "fuente": { "oficial": "https://github.com/microsoft/terminal" },
      "instalacion": { "metodo": "winget", "arch": "x64" },
      "verificacion": { "firmanteEsperado": ["Microsoft Corporation"], "comprobarFirmaPostInstalacion": false, "nota": "Paquete MSIX: la ruta del binario no es fija, se omite la comprobacion post-instalacion." },
      "compatibilidad": { "ediciones": ["windows-11-pro", "windows-11-enterprise", "windows-10-enterprise-multi-session"], "nota": "En Windows Server la Store no esta disponible; winget puede instalarlo pero el shell de Server no registra MSIX de usuario igual que un cliente. Si falla, se usa la consola clasica (no es un error fatal)." },
      "postInstalacion": [],
      "riesgos": []
    },
    {
      "id": "VideoLAN.VLC",
      "nombre": "VLC media player",
      "categoria": "utilidad",
      "conjuntos": ["utilities", "gaming", "full"],
      "descripcion": "Reproductor multimedia universal. Cubre el requisito 'reproductor multimedia' en cualquier edicion, incluido Server.",
      "fuente": { "oficial": "https://www.videolan.org/vlc/", "descargaDirecta": "https://download.videolan.org/pub/videolan/vlc/last/win64/" },
      "instalacion": { "metodo": "winget", "arch": "x64" },
      "verificacion": { "firmanteEsperado": ["VideoLAN"], "ejecutableRuta": "%ProgramFiles%\\VideoLAN\\VLC\\vlc.exe" },
      "compatibilidad": { "ediciones": [] },
      "postInstalacion": [],
      "riesgos": []
    },
    {
      "id": "Microsoft.VisualStudioCode",
      "nombre": "Visual Studio Code",
      "categoria": "utilidad",
      "conjuntos": ["utilities", "full"],
      "descripcion": "Editor. Util para editar perfiles de control (JSON) y scripts dentro de la propia VM.",
      "fuente": { "oficial": "https://code.visualstudio.com/", "descargaDirecta": "https://update.code.visualstudio.com/latest/win32-x64-archive/stable" },
      "instalacion": { "metodo": "winget", "arch": "x64", "nota": "Se usa el instalador de sistema (VSCodeSetup) para que este disponible para todos los usuarios." },
      "verificacion": { "firmanteEsperado": ["Microsoft Corporation"], "ejecutableRuta": "%ProgramFiles%\\Microsoft VS Code\\Code.exe" },
      "compatibilidad": { "ediciones": [] },
      "postInstalacion": [],
      "riesgos": []
    },
    {
      "id": "Google.Chrome",
      "nombre": "Google Chrome",
      "categoria": "navegador",
      "conjuntos": ["utilities", "gaming", "full"],
      "descripcion": "Navegador actualizado (politica de empresa = sin OAuth de primera ejecucion incrustado). Alternativas: Edge (incluido en Windows), Firefox, Brave.",
      "fuente": { "oficial": "https://www.google.com/chrome/", "descargaDirecta": "https://www.google.com/chrome/browser/" },
      "instalacion": { "metodo": "winget", "arch": "x64", "silentFlags": [] },
      "verificacion": { "firmanteEsperado": ["Google LLC"], "ejecutableRuta": "%ProgramFiles%\\Google\\Chrome\\Application\\chrome.exe" },
      "compatibilidad": { "ediciones": [] },
      "postInstalacion": [],
      "riesgos": ["El instalador MSI 'enterprise' no autoactualiza via Google Update de la misma forma que el exe: winget lo actualizara cuando se ejete el mantenimiento."]
    },
    {
      "id": "Mozilla.Firefox",
      "nombre": "Mozilla Firefox",
      "categoria": "navegador",
      "conjuntos": ["utilities", "full"],
      "descripcion": "Navegador alternativo, con soporte de perfiles portables util para sesiones remotas compartidas.",
      "fuente": { "oficial": "https://www.mozilla.org/firefox/", "descargaDirecta": "https://download.mozilla.org/?product=firefox-latest-ssl&os=win64&lang=es-ES" },
      "instalacion": { "metodo": "winget", "arch": "x64" },
      "verificacion": { "firmanteEsperado": ["Mozilla Corporation"], "ejecutableRuta": "%ProgramFiles%\\Mozilla Firefox\\firefox.exe" },
      "compatibilidad": { "ediciones": [] },
      "postInstalacion": [],
      "riesgos": []
    },
    {
      "id": "Brave.Brave",
      "nombre": "Brave Browser",
      "categoria": "navegador",
      "conjuntos": ["full"],
      "descripcion": "Navegador con bloqueo de rastreo integrado; consume menos CPU que las extensiones equivalentes en Chrome.",
      "fuente": { "oficial": "https://brave.com/download/", "descargaDirecta": "https://laptop-updates.brave.com/download/BRV64" },
      "instalacion": { "metodo": "winget", "arch": "x64" },
      "verificacion": { "firmanteEsperado": ["Brave Software, Inc."], "ejecutableRuta": "%ProgramFiles%\\BraveSoftware\\Brave-Browser\\Application\\brave.exe" },
      "compatibilidad": { "ediciones": [] },
      "postInstalacion": [],
      "riesgos": []
    },
    {
      "id": "Microsoft.PowerToys",
      "nombre": "PowerToys",
      "categoria": "utilidad",
      "conjuntos": ["utilities", "gaming", "full"],
      "descripcion": "Incluye Keyboard Manager (remapeo de teclas y atajos), FancyZones (multiventana), Always on Top y Awake. Cubre 'configuracion de teclas' y 'atajos' del lado del host.",
      "fuente": { "oficial": "https://learn.microsoft.com/windows/powertoys/", "descargaDirecta": "https://github.com/microsoft/PowerToys/releases" },
      "instalacion": { "metodo": "winget", "arch": "x64" },
      "verificacion": { "firmanteEsperado": ["Microsoft Corporation", "Microsoft Corporation."], "ejecutableRuta": "%ProgramFiles%\\PowerToys\\PowerToys.exe" },
      "compatibilidad": { "ediciones": ["windows-11-pro", "windows-11-enterprise", "windows-10-enterprise-multi-session", "windows-server-2025-desktop"], "nota": "En Server 2022 algunas funciones (FancyZones/Advanced Paste) estan limitadas por la version de WinUI." },
      "postInstalacion": ["quitar-de-autostart"],
      "riesgos": []
    },
    {
      "id": "Notepad++.Notepad++",
      "nombre": "Notepad++",
      "categoria": "utilidad",
      "conjuntos": ["utilities", "full"],
      "descripcion": "Editor de texto avanzado para configurar perfiles de juegos (mas alla del Bloc de notas incluido).",
      "fuente": { "oficial": "https://notepad-plus-plus.org/downloads/" },
      "instalacion": { "metodo": "winget", "arch": "x64" },
      "verificacion": { "firmanteEsperado": ["Notepad++", "Don HO"], "ejecutableRuta": "%ProgramFiles%\\Notepad++\\notepad++.exe" },
      "compatibilidad": { "ediciones": [] },
      "postInstalacion": [],
      "riesgos": []
    },
    {
      "id": "ShareX.ShareX",
      "nombre": "ShareX",
      "categoria": "utilidad",
      "conjuntos": ["utilities", "gaming", "full"],
      "descripcion": "Captura de pantalla, region, ventana y grabacion de pantalla. Cubre 'herramientas de captura de pantalla' de forma completa en todas las ediciones (incluido Server, donde Recorte esta recortado).",
      "fuente": { "oficial": "https://getsharex.com/downloads/", "descargaDirecta": "https://github.com/ShareX/ShareX/releases" },
      "instalacion": { "metodo": "winget", "arch": "x64", "versionObservada": "21.0.0" },
      "verificacion": { "firmanteEsperado": ["ShareX Team", "ShareX"], "ejecutableRuta": "%ProgramFiles%\\ShareX\\ShareX.exe" },
      "compatibilidad": { "ediciones": [] },
      "postInstalacion": ["crear-carpeta-capturas"],
      "riesgos": ["Las plantillas de subida a la nube (imgur, etc.) quedan desactivadas: el bootstrap no configura credenciales."]
    },
    {
      "id": "TechPowerUp.GPU-Z",
      "nombre": "GPU-Z",
      "categoria": "diagnostico",
      "conjuntos": ["utilities", "gaming", "full"],
      "descripcion": "Verificacion de GPU, VRAM, bus, driver y API soportadas: la prueba rapida de 'comprobacion de aceleracion por GPU'.",
      "fuente": { "oficial": "https://www.techpowerup.com/gpuz/" },